{"ok":true,"command":"evidence.add","code":"CASE_OK","message":"Governed snapshot mutation committed","data":{"snapshot":{"dossier_id":"case-dossier-1","title":"Release integrity","objective":"Keep artifact current","scope":{"in":["artifact.txt"],"out":["deployment"]},"constraints":["local-only"],"acceptance_criteria":[{"criterion_id":"criterion-a","statement":"Artifact digest matches","verification":"mechanical"}],"state_revision":"3","state_digest":"sha256:e8379cfdeeb01b9c823c8ce819c40d1afa5c247833a58bd1547586a70853c4b6","last_operation":{"operation_id":"op-intervene","input_digest":"sha256:a3ad1ac31378fc6d61f1c2229cc06c72dd4821ca04d6b9e2095f5ae4b02e42b6","basis_revision":"2","resulting_revision":"3"},"active_run":{"run_id":"case-run-1","actor_id":"actor-a","started_by_handoff_id":null},"evidence":[{"evidence_id":"evidence-op-evidence","criterion_ids":["criterion-a"],"captured_at":"2026-09-04T03:02:01Z","freshness":"recompute_on_check","limitations":[],"kind":"file","location":{"repository_relative_path":"artifact.txt"},"artifact_digest":"sha256:2d27fbdf4e8ca207afbfa388ca9172fbcc6c70e534af2476b3b704f87debadcf","artifact_size":"3"},{"evidence_id":"evidence-op-intervene","criterion_ids":["criterion-a"],"captured_at":"2026-09-04T03:02:01Z","freshness":"human_review","limitations":["not-local"],"kind":"external_reference","location":{"uri":"https://example.invalid/evidence"}}],"current_handoff_id":null,"current_submission_id":"submission-op-submit","current_decision_id":null},"evidence":{"evidence_id":"evidence-op-intervene","criterion_ids":["criterion-a"],"captured_at":"2026-09-04T03:02:01Z","freshness":"human_review","limitations":["not-local"],"kind":"external_reference","location":{"uri":"https://example.invalid/evidence"}}},"remediation":null}
