{"ok":true,"command":"dossier.create","code":"CASE_OK","message":"Dossier created","data":{"snapshot":{"dossier_id":"case-dossier-1","title":"Same display title","objective":"First","scope":{"in":["artifact.txt"],"out":["deployment"]},"constraints":["local-only"],"acceptance_criteria":[{"criterion_id":"criterion-a","statement":"Artifact digest matches","verification":"mechanical"}],"state_revision":"0","state_digest":"sha256:4b7da468df0fbe7ac57217519e770aef7b32a890e4432e2918d45c0c15b82180","last_operation":null,"active_run":{"run_id":"case-run-1","actor_id":"actor-a","started_by_handoff_id":null},"evidence":[],"current_handoff_id":null,"current_submission_id":null,"current_decision_id":null}},"remediation":null}
