{"ok":true,"command":"dossier.check","code":"CASE_OK","message":"Dossier checks failed","data":{"dossier_id":"case-dossier-1","content_digest":"sha256:0a3c5c4fe80a923f459dc142f6505c1114a0e6d03ae3dcfa16c6418b595dd5d3","observed_evidence_digest":"sha256:726f8d54c9e898b4c8392ce9e6127c572574da1f9ca0be951eb2c46d137b875e","invariant_results":[{"code":"CASE_I_PARSE","status":"passed"},{"code":"CASE_I_SCHEMA","status":"passed"},{"code":"CASE_I_STATE","status":"passed"},{"code":"CASE_I_EVIDENCE_SAFETY","status":"passed"},{"code":"CASE_I_EVIDENCE_INTEGRITY","status":"passed"},{"code":"CASE_I_EVIDENCE_LINKS","status":"passed"},{"code":"CASE_I_ENVELOPE_INTEGRITY","status":"passed"},{"code":"CASE_I_DERIVED_STATUS","status":"passed"}],"criterion_results":[{"criterion_id":"criterion-a","status":"failed","supporting_evidence_ids":[]}],"stable_warning_codes":[],"verdict":"failed"},"remediation":null}
