{"ok":true,"command":"evidence.add","code":"CASE_OK","message":"Governed snapshot mutation committed","data":{"snapshot":{"dossier_id":"case-dossier-1","title":"Release integrity","objective":"Keep artifact current","scope":{"in":["artifact.txt"],"out":["deployment"]},"constraints":["local-only"],"acceptance_criteria":[{"criterion_id":"criterion-a","statement":"Artifact digest matches","verification":"mechanical"}],"state_revision":"1","state_digest":"sha256:ac9e00e434216d3dcce344a464fd16dfd52924ca8dddeae5212ce0aadef2a9b5","last_operation":{"operation_id":"op-evidence","input_digest":"sha256:5955b7df07a916b6ad78b8a04622e09fb7bcc5a7de35ab386598163fcc2df9aa","basis_revision":"0","resulting_revision":"1"},"active_run":{"run_id":"case-run-1","actor_id":"actor-a","started_by_handoff_id":null},"evidence":[{"evidence_id":"evidence-op-evidence","criterion_ids":["criterion-a"],"captured_at":"2026-09-04T03:02:01Z","freshness":"recompute_on_check","limitations":[],"kind":"file","location":{"repository_relative_path":"artifact.txt"},"artifact_digest":"sha256:2d27fbdf4e8ca207afbfa388ca9172fbcc6c70e534af2476b3b704f87debadcf","artifact_size":"3"}],"current_handoff_id":null,"current_submission_id":null,"current_decision_id":null},"evidence":{"evidence_id":"evidence-op-evidence","criterion_ids":["criterion-a"],"captured_at":"2026-09-04T03:02:01Z","freshness":"recompute_on_check","limitations":[],"kind":"file","location":{"repository_relative_path":"artifact.txt"},"artifact_digest":"sha256:2d27fbdf4e8ca207afbfa388ca9172fbcc6c70e534af2476b3b704f87debadcf","artifact_size":"3"}},"remediation":null}
