{"ok":true,"command":"dossier.create","code":"CASE_OK","message":"Dossier created","data":{"snapshot":{"dossier_id":"case-dossier-2","title":"Replacement governed objective","objective":"Objective B","scope":{"in":["artifact.txt"],"out":["deployment"]},"constraints":["local-only"],"acceptance_criteria":[{"criterion_id":"criterion-a","statement":"Artifact digest matches","verification":"mechanical"}],"state_revision":"0","state_digest":"sha256:e739f14f00be6508e97283143bba1d49da1277e79720dff48e631203049a7d3b","last_operation":null,"active_run":{"run_id":"case-run-2","actor_id":"actor-a","started_by_handoff_id":null},"evidence":[],"current_handoff_id":null,"current_submission_id":null,"current_decision_id":null}},"remediation":null}
