{"ok":true,"command":"handoff.offer","code":"CASE_OK","message":"Handoff offered","data":{"handoff_id":"handoff-op-first","dossier_id":"case-dossier-1","from_run_id":"case-run-1","to_actor_id":"actor-b","basis_revision":"0","basis_state_digest":"sha256:c8fdd08bc12368f98d3aaa736d1bc1057d07ea18aba6b549a6039021205c175d","published_revision":"1","offered_content_digest":"sha256:0a3c5c4fe80a923f459dc142f6505c1114a0e6d03ae3dcfa16c6418b595dd5d3","created_operation_id":"op-first"},"remediation":null}
