{"ok":true,"command":"dossier.show","code":"CASE_OK","message":"Current dossier","data":{"dossier_id":"case-dossier-1","title":"Release integrity","objective":"Keep artifact current","scope":null,"constraints":null,"active_run":{"run_id":"case-run-1","actor_id":"actor-a","started_by_handoff_id":null},"state_revision":"3","state_digest":"sha256:0bfe199193ab19a07a337887a3f5f89cbd24a80f391fbd3e44cf4104ae66b789","criterion_results":[{"criterion_id":"criterion-a","status":"mechanically_satisfied","supporting_evidence_ids":["evidence-op-evidence"]}],"evidence_gaps":[],"current_checks":"passed","review":"changes_requested","acceptance":"rejected","handoff":"none","recommended_next_action":"CASE_NEXT_ADDRESS_CHANGES","unresolved_warnings":[]},"remediation":null}
