{"ok":true,"command":"dossier.show","code":"CASE_OK","message":"Current dossier","data":{"dossier_id":"case-dossier-1","title":"Release integrity","objective":"Keep artifact current","scope":null,"constraints":null,"active_run":{"run_id":"case-run-1","actor_id":"actor-a","started_by_handoff_id":null},"state_revision":"3","state_digest":"sha256:cadf0d8c8802e3877ec24c3544b3db35a226c9caca5abb96f57efe9f8292159d","criterion_results":[{"criterion_id":"criterion-a","status":"failed","supporting_evidence_ids":[]}],"evidence_gaps":["criterion-a"],"current_checks":"failed","review":"working","acceptance":"stale","handoff":"none","recommended_next_action":"CASE_NEXT_ADD_EVIDENCE","unresolved_warnings":["CASE_L_EVIDENCE_CHANGED"]},"remediation":null}
