{"ok":true,"command":"evidence.add","code":"CASE_OK","message":"Governed snapshot mutation committed","data":{"snapshot":{"dossier_id":"case-dossier-1","title":"Release integrity","objective":"Keep artifact current","scope":{"in":["artifact.txt"],"out":["deployment"]},"constraints":["local-only"],"acceptance_criteria":[{"criterion_id":"criterion-a","statement":"Artifact digest matches","verification":"mechanical"}],"state_revision":"2","state_digest":"sha256:7a07717ed7c3efa1a4ebeef54d62be801dbb18158f73626d3accb71226b8c1b5","last_operation":{"operation_id":"op-after-recovery","input_digest":"sha256:072583aea6c4f66a90e9e2e76281ca32ffff5d0dac23aef9cb82032878586e33","basis_revision":"1","resulting_revision":"2"},"active_run":{"run_id":"case-run-1","actor_id":"actor-a","started_by_handoff_id":null},"evidence":[{"evidence_id":"evidence-op-after-recovery","criterion_ids":["criterion-a"],"captured_at":"2026-09-04T03:02:01Z","freshness":"human_review","limitations":["post-recovery-writer"],"kind":"external_reference","location":{"uri":"https://example.invalid/post-recovery"}}],"current_handoff_id":null,"current_submission_id":null,"current_decision_id":null},"evidence":{"evidence_id":"evidence-op-after-recovery","criterion_ids":["criterion-a"],"captured_at":"2026-09-04T03:02:01Z","freshness":"human_review","limitations":["post-recovery-writer"],"kind":"external_reference","location":{"uri":"https://example.invalid/post-recovery"}}},"remediation":null}
