{"ok":true,"command":"dossier.create","code":"CASE_OK","message":"Dossier created","data":{"snapshot":{"dossier_id":"case-dossier-2","title":"Same display title","objective":"Second","scope":{"in":["artifact.txt"],"out":["deployment"]},"constraints":["local-only"],"acceptance_criteria":[{"criterion_id":"criterion-a","statement":"Artifact digest matches","verification":"mechanical"}],"state_revision":"0","state_digest":"sha256:31380086db19790de7302b977ae987ae88b44c9c54ea1c637a6af6f8651bb13c","last_operation":null,"active_run":{"run_id":"case-run-2","actor_id":"actor-b","started_by_handoff_id":null},"evidence":[],"current_handoff_id":null,"current_submission_id":null,"current_decision_id":null}},"remediation":null}
