{"ok":true,"command":"handoff.offer","code":"CASE_OK","message":"Handoff offered","data":{"handoff_id":"handoff-op-preserve","dossier_id":"case-dossier-1","from_run_id":"case-run-1","to_actor_id":"actor-b","basis_revision":"3","basis_state_digest":"sha256:cadf0d8c8802e3877ec24c3544b3db35a226c9caca5abb96f57efe9f8292159d","published_revision":"4","offered_content_digest":"sha256:f7f924140777ef1453580030c21cd01faef6d1dd198829ad4e841e96c21158d1","created_operation_id":"op-preserve"},"remediation":null}
