{"ok":true,"command":"dossier.show","code":"CASE_OK","message":"Current dossier","data":{"dossier_id":"case-dossier-1","title":"Release integrity","objective":"Keep artifact current","scope":null,"constraints":null,"active_run":{"run_id":"case-run-1","actor_id":"actor-a","started_by_handoff_id":null},"state_revision":"2","state_digest":"sha256:e78c9daa3ed2aaa850b9ff8d5922873bf442faed6137671b3ebccbb17abc41d3","criterion_results":[{"criterion_id":"criterion-a","status":"mechanically_satisfied","supporting_evidence_ids":["evidence-op-evidence"]}],"evidence_gaps":[],"current_checks":"passed","review":"ready_for_review","acceptance":"pending","handoff":"none","recommended_next_action":"CASE_NEXT_REVIEW_SUBMISSION","unresolved_warnings":["CASE_L_ORPHAN_ENVELOPE"]},"remediation":null}
