{"ok":true,"command":"decision.accept","code":"CASE_OK","message":"Recorded Human Acceptance","data":{"decision_id":"decision-op-decision","dossier_id":"case-dossier-1","submission_id":"submission-op-submit","submission_digest":"sha256:161d38370434dbbfb48a693574c48cdc08849362f3132e91c56e001c80fba731","decision":"accepted","reviewer_id":"reviewer-a","criteria_reviewed":["criterion-a"],"comment":"Reviewed exact submission","decided_at":"2026-09-04T03:02:01Z","created_operation_id":"op-decision","identity_assurance":"recorded-interactive-claim"},"remediation":null}
