{"ok":true,"command":"handoff.accept","code":"CASE_OK","message":"Handoff accepted","data":{"dossier_id":"case-dossier-1","title":"Release integrity","objective":"Keep artifact current","scope":{"in":["artifact.txt"],"out":["deployment"]},"constraints":["local-only"],"acceptance_criteria":[{"criterion_id":"criterion-a","statement":"Artifact digest matches","verification":"mechanical"}],"state_revision":"3","state_digest":"sha256:54c8a4ed0df8529b4e1dfc6b8a5db398a4361c5605005fc2313401d5c287addc","last_operation":{"operation_id":"op-accept","input_digest":"sha256:a539f86231aff70a8a2c9a2bae89f952482dd00cb2d311c3dc66e68997f229c4","basis_revision":"2","resulting_revision":"3"},"active_run":{"run_id":"case-run-2","actor_id":"actor-b","started_by_handoff_id":"handoff-op-offer"},"evidence":[{"evidence_id":"evidence-op-evidence","criterion_ids":["criterion-a"],"captured_at":"2026-09-04T03:02:01Z","freshness":"recompute_on_check","limitations":[],"kind":"file","location":{"repository_relative_path":"artifact.txt"},"artifact_digest":"sha256:2d27fbdf4e8ca207afbfa388ca9172fbcc6c70e534af2476b3b704f87debadcf","artifact_size":"3"}],"current_handoff_id":"handoff-op-offer","current_submission_id":null,"current_decision_id":null},"remediation":null}
