{"ok":true,"command":"dossier.check","code":"CASE_OK","message":"Dossier checks failed","data":{"dossier_id":"case-dossier-1","content_digest":"sha256:f7f924140777ef1453580030c21cd01faef6d1dd198829ad4e841e96c21158d1","observed_evidence_digest":"sha256:2b92347a799d352c48df1644e47f5cb9c2b32c671187e9521fb86b6ab7a47872","invariant_results":[{"code":"CASE_I_PARSE","status":"passed"},{"code":"CASE_I_SCHEMA","status":"passed"},{"code":"CASE_I_STATE","status":"passed"},{"code":"CASE_I_EVIDENCE_SAFETY","status":"passed"},{"code":"CASE_I_EVIDENCE_INTEGRITY","status":"failed"},{"code":"CASE_I_EVIDENCE_LINKS","status":"passed"},{"code":"CASE_I_ENVELOPE_INTEGRITY","status":"passed"},{"code":"CASE_I_DERIVED_STATUS","status":"passed"}],"criterion_results":[{"criterion_id":"criterion-a","status":"failed","supporting_evidence_ids":[]}],"stable_warning_codes":["CASE_L_EVIDENCE_CHANGED"],"verdict":"failed"},"remediation":null}
