{"ok":true,"command":"dossier.show","code":"CASE_OK","message":"Current dossier","data":{"dossier_id":"case-dossier-1","title":"Release integrity","objective":"Keep artifact current","scope":null,"constraints":null,"active_run":{"run_id":"case-run-2","actor_id":"actor-b","started_by_handoff_id":"handoff-op-offer"},"state_revision":"4","state_digest":"sha256:fcbb32b8fd0111b8b4359f37c2c6c7c686d3f6b142c28720e507c866a39ae405","criterion_results":[{"criterion_id":"criterion-a","status":"mechanically_satisfied","supporting_evidence_ids":["evidence-op-evidence"]}],"evidence_gaps":[],"current_checks":"passed","review":"working","acceptance":"pending","handoff":"accepted","recommended_next_action":"CASE_NEXT_CREATE_SUBMISSION","unresolved_warnings":["CASE_L_HUMAN_REVIEW_REQUIRED"]},"remediation":null}
